{
  "id": "018f35a4-c6d2-7cb8-af5a-0a00f329c001",
  "schemaVersion": "1.0.0",
  "eventVersion": 1,
  "source": "self-healing-systems",
  "type": "heal.completed",
  "severity": "info",
  "timestamp": "2026-02-26T18:00:00Z",
  "correlationId": "018f35a4-c6d2-7cb8-af5a-0a00f329c000",
  "payload": {
    "patchSummary": "Applied ZERO_DIVISION remediation.",
    "changedFiles": ["app/logic.py", "tests/test_compute.py"]
  }
}
